Rk,Nation,# Players,Min,List
1,eng England,236,"241,227","Harry Kane, Dele Alli, Jermain Defoe, Jamie Vardy, Troy Deeney, Ross Barkley, James Milner, Raheem Sterling, Gary Cahill, Charlie Daniels ..."
2,es Spain,37,"56,564","Diego Costa, Álvaro Negredo, Fernando Llorente, César Azpilicueta, Pedro, David Silva, Marcos Alonso, Nacho Monreal, Oriol Romeu, David de Gea ..."
3,fr France,28,"34,581","Étienne Capoue, Paul Pogba, N'Golo Kanté, Hugo Lloris, Laurent Koscielny, Yohan Cabaye, Olivier Giroud, Anthony Martial, Dimitri Payet, Gaël Clichy ..."
4,be Belgium,23,"39,323","Romelu Lukaku, Kevin De Bruyne, Eden Hazard, Christian Benteke, Thibaut Courtois, Kevin Mirallas, Nacer Chadli, Jan Vertonghen, Toby Alderweireld, Simon Mignolet ..."
,,,,View Complete Nationalities Table
