Rk,Nation,# Players,Min,List
1,eng England,152,"252,500","Alan Shearer, Kevin Phillips, Matt Jansen, Michael Owen, Darius Vassell, Teddy Sheringham, David Beckham, Frank Lampard, Trevor Sinclair, Danny Murphy ..."
2,fr France,37,"61,026","Thierry Henry, Laurent Robert, Robert Pirès, Steed Malbranque, Sylvain Wiltord, Louis Saha, Sébastien Schemmel, Patrick Vieira, Mikaël Silvestre, Sylvain Legwinski ..."
3,ie Ireland,30,"44,687","Ian Harte, Matt Holland, Damien Duff, Steve Finnan, Shay Given, Dean Kiely, Roy Keane, Andy O'Brien, Steve Staunton, Niall Quinn ..."
4,sco Scotland,22,"37,638","David Weir, Christian Dailly, Scot Gemmill, Matt Elliott, Callum Davidson, John Collins, Dominic Matteo, Paul Telfer, Neil Sullivan, Robbie Stockdale ..."
,,,,View Complete Nationalities Table
