Rk,Nation,# Players,Min,List
1,eng England,174,"244,423","Frank Lampard, Darren Bent, Wayne Rooney, James Milner, Jermain Defoe, Kevin Davies, Ashley Young, Gabby Agbonlahor, Steven Gerrard, Leighton Baines ..."
2,ie Ireland,37,"54,551","Kevin Doyle, Richard Dunne, Damien Duff, Barry Ferguson, Stephen Hunt, Stephen Carr, Shay Given, Rory Delap, Glenn Whelan, Marc Wilson ..."
3,fr France,27,"52,503","Nicolas Anelka, Florent Malouda, Charles N'Zogbia, Louis Saha, Patrice Evra, Gaël Givet, Abou Diaby, Julien Faubert, Steven Nzonzi, Bacary Sagna ..."
4,sco Scotland,20,"27,131","Steven Fletcher, Graham Alexander, Darren Fletcher, James McFadden, Christophe Berra, Craig Gordon, Phil Bardsley, Kevin McDonald, Gary Caldwell, Danny Fox ..."
,,,,View Complete Nationalities Table
